{
  "trajectory_id": "release_via_ci-proxy-provenance-s0",
  "scenario": "release_via_ci",
  "arm": "proxy",
  "note_variant": "provenance",
  "seed": 0,
  "n_legs": 3,
  "db_dir": "/Users/swapnanilsaha/vectr-eval-runs/longitudinal-s0/release_via_ci-proxy-provenance-s0/db",
  "created_utc": "20260730T061034Z",
  "updated_utc": "20260730T064857Z",
  "leg1_id": "cdb7c650324154abb0069044a573b84aea8933535fe3bd043248dbd51bf659e6",
  "leg1_source": "/Users/swapnanilsaha/vectr-eval-runs/longitudinal-s0/_shared/leg1/release_via_ci-s0",
  "planted_note_id": 1,
  "planted_anchor": "note:1",
  "legs": [
    {
      "k": 1,
      "status": "done",
      "result_path": "/Users/swapnanilsaha/vectr-eval-runs/longitudinal-s0/_shared/leg1/release_via_ci-s0/result.json",
      "end_state_tar": "/Users/swapnanilsaha/vectr-eval-runs/longitudinal-s0/_shared/leg1/release_via_ci-s0/workspace.tar",
      "end_state_manifest_sha256": "66cff1cfce2463e9803264c233d8ae90945c69719647a73906236ed64a3cb7ac",
      "usd": 0.29990220000000006,
      "valid": true,
      "started_utc": null,
      "finished_utc": null
    },
    {
      "k": 2,
      "status": "done",
      "result_path": "/Users/swapnanilsaha/vectr-eval-runs/longitudinal-s0/release_via_ci-proxy-provenance-s0/legs/2/artifacts/result.json",
      "end_state_tar": "/Users/swapnanilsaha/vectr-eval-runs/longitudinal-s0/release_via_ci-proxy-provenance-s0/legs/2/end-state.tar",
      "end_state_manifest_sha256": "03f905936c3cc356b5e96ded9298db5e410de8dbcbb89b2b805e80ca21aa27f0",
      "usd": 0.4068156000000001,
      "valid": true,
      "started_utc": "20260730T061034Z",
      "finished_utc": "20260730T061225Z"
    },
    {
      "k": 3,
      "status": "done",
      "result_path": "/Users/swapnanilsaha/vectr-eval-runs/longitudinal-s0/release_via_ci-proxy-provenance-s0/legs/3/artifacts/result.json",
      "end_state_tar": "/Users/swapnanilsaha/vectr-eval-runs/longitudinal-s0/release_via_ci-proxy-provenance-s0/legs/3/end-state.tar",
      "end_state_manifest_sha256": "5852e26d4833f54f0843997c26ee26a21508bc7ff1ba32df33a1b460a7d3ca69",
      "usd": 0.3594071999999999,
      "valid": true,
      "started_utc": "20260730T061225Z",
      "finished_utc": "20260730T061350Z"
    }
  ],
  "trajectory_valid_through": 3,
  "spend_usd": 1.07,
  "tier": "T3",
  "hook_attestation": null,
  "notes": null
}