{
  "trajectory_id": "deploy_reverted_by_reconciler-none-none-s0",
  "scenario": "deploy_reverted_by_reconciler",
  "arm": "none",
  "note_variant": "none",
  "seed": 0,
  "n_legs": 3,
  "db_dir": "/Users/swapnanilsaha/vectr-eval-runs/longitudinal-s0/deploy_reverted_by_reconciler-none-none-s0/db",
  "created_utc": "20260729T205359Z",
  "updated_utc": "20260729T210136Z",
  "leg1_id": "3219eac92dea05e5b46f9fa83f724dd04e5aaaebe15ac2e9fc698d269c234d88",
  "leg1_source": "/Users/swapnanilsaha/vectr-eval-runs/longitudinal-s0/_shared/leg1/deploy_reverted_by_reconciler-s0",
  "planted_note_id": null,
  "planted_anchor": null,
  "legs": [
    {
      "k": 1,
      "status": "done",
      "result_path": "/Users/swapnanilsaha/vectr-eval-runs/longitudinal-s0/_shared/leg1/deploy_reverted_by_reconciler-s0/result.json",
      "end_state_tar": "/Users/swapnanilsaha/vectr-eval-runs/longitudinal-s0/_shared/leg1/deploy_reverted_by_reconciler-s0/workspace.tar",
      "end_state_manifest_sha256": "e6461655420b9c92e068198953e9dae33e41a1769beb3aa3b7d1a364c2c29c18",
      "usd": 0,
      "valid": true,
      "started_utc": null,
      "finished_utc": null
    },
    {
      "k": 2,
      "status": "done",
      "result_path": "/Users/swapnanilsaha/vectr-eval-runs/longitudinal-s0/deploy_reverted_by_reconciler-none-none-s0/legs/2/artifacts/result.json",
      "end_state_tar": "/Users/swapnanilsaha/vectr-eval-runs/longitudinal-s0/deploy_reverted_by_reconciler-none-none-s0/legs/2/end-state.tar",
      "end_state_manifest_sha256": "e6461655420b9c92e068198953e9dae33e41a1769beb3aa3b7d1a364c2c29c18",
      "usd": 0,
      "valid": true,
      "started_utc": "20260729T205720Z",
      "finished_utc": "20260729T210045Z"
    },
    {
      "k": 3,
      "status": "done",
      "result_path": "/Users/swapnanilsaha/vectr-eval-runs/longitudinal-s0/deploy_reverted_by_reconciler-none-none-s0/legs/3/artifacts/result.json",
      "end_state_tar": "/Users/swapnanilsaha/vectr-eval-runs/longitudinal-s0/deploy_reverted_by_reconciler-none-none-s0/legs/3/end-state.tar",
      "end_state_manifest_sha256": "e6461655420b9c92e068198953e9dae33e41a1769beb3aa3b7d1a364c2c29c18",
      "usd": 0.180873,
      "valid": true,
      "started_utc": "20260729T210045Z",
      "finished_utc": "20260729T210136Z"
    }
  ],
  "trajectory_valid_through": 3,
  "spend_usd": 0.18,
  "tier": "T1",
  "hook_attestation": null,
  "notes": null
}